Domestic Opening,Name,Domestic Distributor,Earliest Release Date,MPAA,Running Time,Genres,Overview,Actors,Film makers
"$30,436,123",John Wick: Chapter 2,Lionsgate Films,"February 8, 2017 (APAC, EMEA)",R,2 hr 2 min,Action Crime Thriller,"After returning to the criminal underworld to repay a debt, John Wick discovers that a large bounty has been put on his life.","['Keanu Reeves', 'Riccardo Scamarcio', 'Ian McShane', 'Ruby Rose']","['Chad Stahelski', 'Derek Kolstad', 'Derek Kolstad', 'Basil Iwanyk', 'Erica Lee', 'Tyler Bates', 'Joel J. Richard', 'Dan Laustsen', 'Evan Schiff', 'Kevin Kavanaugh']"
"$18,676,033",Ghost in the Shell,Paramount Pictures,"March 29, 2017 (APAC, EMEA)",PG-13,1 hr 47 min,,"In the near future, Major Mira Killian is the first of her kind: A human saved from a terrible crash, who is cyber-enhanced to be a perfect soldier devoted to stopping the world's most dangerous criminals.","['Scarlett Johansson', 'Pilou Asbæk', 'Takeshi Kitano', 'Juliette Binoche']","['Rupert Sanders', 'Shirow Masamune', 'Jamie Moss', 'William Wheeler', 'Ehren Kruger', 'Ari Arad', 'Avi Arad', 'Michael Costigan', 'Steven Paul', 'Lorne Balfe', 'Clint Mansell', 'Jess Hall', 'Billy Rich', 'Neil Smith', 'Jan Roelfs']"
"$322,168","Three Billboards Outside Ebbing, Missouri",Fox Searchlight,"November 10, 2017 (Domestic)",R,1 hr 55 min,Comedy Crime Drama,A mother personally challenges the local authorities to solve her daughter's murder when they fail to catch the culprit.,"['Frances McDormand', 'Woody Harrelson', 'Sam Rockwell', 'Caleb Landry Jones']","['Martin McDonagh', 'Martin McDonagh', 'Graham Broadbent', 'Peter Czernin', 'Martin McDonagh', 'Carter Burwell', 'Ben Davis', 'Jon Gregory', 'Inbal Weinberg']"
"$160,739",Duckweed,China Lion Film Distribution,"January 28, 2017 (China)",,1 hr 42 min,Comedy Drama Fantasy,"In the near-death after an accident, a sports car driver time-travelled back to the 1990s to meet his severe father and never-seen mother in a small Chinese town.","['Chao Deng', 'Eddie Peng', 'Zanilia Zhao', 'Zijian Dong']","['Han Han', 'Han Han', 'Fei Peng', 'Chengma Zhiyuan']"
"$175,006",Darkest Hour,Focus Features,"November 22, 2017 (Domestic)",PG-13,2 hr 5 min,Drama War,"In May 1940, the fate of World War II hangs on Winston Churchill, who must decide whether to negotiate with Adolf Hitler, or fight on knowing that it could mean the end of the British Empire.","['Gary Oldman', 'Lily James', 'Kristin Scott Thomas', 'Ben Mendelsohn']","['Joe Wright', 'Anthony McCarten', 'Tim Bevan', 'Lisa Bruce', 'Eric Fellner', 'Anthony McCarten', 'Douglas Urbanski', 'Dario Marianelli', 'Bruno Delbonnel', 'Valerio Bonelli', 'Sarah Greenwood']"
"$15,371,270",King Arthur: Legend of the Sword,Warner Bros.,"May 9, 2017 (Indonesia)",PG-13,2 hr 6 min,,"Robbed of his birthright, Arthur comes up the hard way in the back alleys of the city. But once he pulls the sword from the stone, he is forced to acknowledge his true legacy - whether he likes it or not.","['Charlie Hunnam', 'Astrid Bergès-Frisbey', 'Jude Law', 'Djimon Hounsou']","['Guy Ritchie', 'Joby Harold', 'Guy Ritchie', 'Lionel Wigram', 'David Dobkin', 'Joby Harold', 'Steve Clark-Hall', 'Akiva Goldsman', 'Joby Harold', 'Guy Ritchie', 'Tory Tunnell', 'Lionel Wigram', 'Daniel Pemberton', 'John Mathieson', 'James Herbert', 'Gemma Jackson']"
"$13,113,024",The Foreigner,STX Entertainment,"September 30, 2017 (APAC, China)",R,1 hr 53 min,,"A humble businessman with a buried past seeks justice when his daughter is killed in an act of terrorism. A cat-and-mouse conflict ensues with a government official, whose past may hold clues to the killers' identities.","['Katie Leung', 'Jackie Chan', 'Rufus Jones', 'Mark Tandy']","['Martin Campbell', 'David Marconi', 'Stephen Leather', 'Jackie Chan', 'Wayne Marc Godfrey', 'Claire Kupchak', 'D. Scott Lumpkin', 'Jamie Marshall', 'Jianhong Qi', 'Arthur Sarkissian', 'Cathy Schulman', 'John Zeng', 'Cliff Martinez', 'David Tattersall', 'Angela M. Catanzaro', 'Alex Cameron']"
"$40,300,288",Power Rangers,Lionsgate Films,"March 22, 2017 (APAC, EMEA)",PG-13,2 hr 4 min,,"When Earth is on the verge of an alien invasion, five teenagers, who are infused with superhuman abilities, must harness their newfound powers to battle this threat - as the Power Rangers.","['Dacre Montgomery', 'Naomi Scott', 'RJ Cyler', 'Ludi Lin']","['Dean Israelite', 'John Gatins', 'Matt Sazama', 'Burk Sharpless', 'Michele Mulroney', 'Kieran Mulroney', 'Haim Saban', 'Saburo Yatsude', 'Shotaro Ishinomori', 'Shuki Levy', 'Marty Bowen', 'Brian Casentini', 'Wyck Godfrey', 'Haim Saban', 'Brian Tyler', 'Matthew J. Lloyd', 'Martin Bernfeld', 'Dody Dorn', 'Andrew Menzies']"
"$31,201,920",Girls Trip,Universal Pictures,"July 21, 2017 (Domestic)",R,2 hr 2 min,,"When four lifelong friends travel to New Orleans for the annual Essence Festival, sisterhoods are rekindled, wild sides are rediscovered, and there's enough dancing, drinking, brawling and romancing to make the Big Easy blush.","['Regina Hall', 'Queen Latifah', 'Jada Pinkett Smith', 'Tiffany Haddish']","['Malcolm D. Lee', 'Erica Rivinoja', 'Kenya Barris', 'Tracy Oliver', 'Kenya Barris', 'Tracy Oliver', 'Malcolm D. Lee', 'Will Packer', 'David Newman', 'Greg Gardiner', 'Paul Millspaugh', 'Keith Brian Burns']"
"$16,776,390",American Made,Universal Pictures,"August 23, 2017 (Egypt)",R,1 hr 55 min,,"The story of Barry Seal, an American pilot who became a drug-runner for the CIA in the 1980s in a clandestine operation that would be exposed as the Iran-Contra Affair.","['Tom Cruise', 'Domhnall Gleeson', 'Sarah Wright', 'Jesse Plemons']","['Doug Liman', 'Gary Spinelli', 'Ray Angelic', 'Doug Davison', 'Brian Grazer', 'Brian Oliver', 'Kim Roth', 'Tyler Thompson', 'Christophe Beck', 'César Charlone', 'Andrew Mondshein', 'Dan Weil']"
"$16,759,161",A Bad Moms Christmas,STX Entertainment,"November 1, 2017 (EMEA, Domestic)",R,1 hr 44 min,,"As their own mothers drop in unexpectedly, our three under-appreciated and over-burdened moms rebel against the challenges and expectations of the Super Bowl for mothers: Christmas.","['Mila Kunis', 'Kristen Bell', 'Kathryn Hahn', 'Jay Hernandez']","['Jon Lucas', 'Scott Moore', 'Jon Lucas', 'Scott Moore', 'Suzanne Todd', 'Christopher Lennertz', 'Mitchell Amundsen', 'James Thomas', 'Marcia Hinds']"
"$26,039,025",Happy Death Day,Universal Pictures,"October 12, 2017 (8 markets)",PG-13,1 hr 36 min,,"A college student must relive the day of her murder over and over again, in a loop that will end only when she discovers her killer's identity.","['Jessica Rothe', 'Israel Broussard', 'Ruby Modine', 'Charles Aitken']","['Christopher Landon', 'Scott Lobdell', 'Jason Blum', 'Bear McCreary', 'Toby Oliver', 'Gregory Plotkin', 'Cece De Stefano']"
"$23,851,539",Captain Underpants: The First Epic Movie,Twentieth Century Fox,"May 31, 2017 (LATAM)",PG,1 hr 29 min,,"Two overly imaginative pranksters named George and Harold hypnotize their principal into thinking he's a ridiculously enthusiastic, incredibly dimwitted superhero named Captain Underpants.","['Kevin Hart', 'Thomas Middleditch', 'Ed Helms', 'Nick Kroll']","['David Soren', 'Nicholas Stoller', 'Dav Pilkey', 'David Soren', 'Mireille Soria', 'Mark Swift', 'Theodore Shapiro', 'Matt Landon', 'Nate Wragg']"
"$20,433,071",The Lego Ninjago Movie,Warner Bros.,"September 20, 2017 (Indonesia)",PG,1 hr 41 min,Action Adventure Animation Comedy Drama Family Fantasy Sci-Fi Thriller,"Shunned by everyone for being the son of an evil warlord, a teenager seeks to defeat him with the help of his fellow ninjas.","['Jackie Chan', 'Dave Franco', 'Fred Armisen', 'Kumail Nanjiani']","['Charlie Bean', 'Paul Fisher', 'Bob Logan', 'Bob Logan', 'Paul Fisher', 'William Wheeler', 'Tom Wheeler', 'Jared Stern', 'John Whittington', 'Hilary Winston', 'Bob Logan', 'Paul Fisher', 'William Wheeler', 'Tom Wheeler', 'Dan Hageman', 'Kevin Hageman', 'Maryann Garger', 'Roy Lee', 'Dan Lin', 'Phil Lord', 'Chris McKay', 'Christopher Miller', 'Mark Mothersbaugh', 'David Scott', 'Craig Welsh', 'David Burrows', 'Garret Elkins', 'Ryan Folsey', 'Julie Rogers', 'John Venzon', 'Annie Beauchamp', 'Kim Taylor', 'Simon Whiteley']"
,Secret Superstar,,"October 18, 2017 (Domestic)",,2 hr 30 min,Drama Music,A talented teenage singer-songwriter living amid domestic abuse becomes a YouTube sensation after a video in which she hides her identity goes viral.,"['Zaira Wasim', 'Meher Vij', 'Raj Arjun', 'Aamir Khan']","['Advait Chandan', 'Advait Chandan', 'Aamir Khan', 'Allen Liu', 'Kiran Rao', 'Prasad Shetty', 'Rohit Sangwan', 'Amit Trivedi', 'Anil Mehta', 'Hemanti Sarkar', 'Pallavi Bagga', 'Suman Roy Mahapatra', 'Imran Manzoor']"
"$13,701,452",The Commuter,Lionsgate Films,"January 12, 2017 (Romania)",PG-13,1 hr 44 min,Action Mystery Thriller,An insurance salesman/ex-cop is caught up in a life-threatening conspiracy during his daily commute home.,"['Liam Neeson', 'Vera Farmiga', 'Patrick Wilson', 'Jonathan Banks']","['Jaume Collet-Serra', 'Byron Willinger', 'Philip de Blasi', 'Byron Willinger', 'Philip de Blasi', 'Ryan Engle', 'Alex Heineman', 'Andrew Rona', 'Roque Baños', 'Paul Cameron', 'Nicolas De Toth', 'Richard Bridgland']"
,Forever Young,,"November 16, 2017 (Uruguay)",,2 hr 18 min,Drama,"From World War, to revolution and ultimately rebirth, Forever Young is the story of four generations spanning a hundred years of modern Chinese history. Each generation faces its own unique set of challenges. Up against corporate corruption, the trials and tribulations of the cultural revolution, and one's duty to nation in time of war, they are faced with choosing their individual paths through history. But as the challenges and turmoil of each generation may differ as time changes, what was learned in the past cannot help but effect the choices that are made in the future as it is passed down from generation to generation. And that is the universal message that being true to yourself is precious. It is the source of strength that empowers one to become the person they want to be, to march forward as far as their hearts desire, into the future.","['Ziyi Zhang', 'Xiaoming Huang', 'Leehom Wang', 'Chang Chen']","['Fangfang Li', 'Fangfang Li', 'Tao Liu', 'Yu Cao', 'Jiuping Cao', 'Lai Pan']"
"$19,153,698",The Dark Tower,Sony Pictures Releasing,"August 3, 2017 (APAC, EMEA)",PG-13,1 hr 35 min,,A boy haunted by visions of a dark tower from a parallel reality teams up with the tower's disillusioned guardian to stop an evil warlock known as the Man in Black who plans to use the boy to destroy the tower and open the gates of Hell.,"['Idris Elba', 'Matthew McConaughey', 'Tom Taylor', 'Dennis Haysbert']","['Nikolaj Arcel', 'Akiva Goldsman', 'Jeff Pinkner', 'Anders Thomas Jensen', 'Nikolaj Arcel', 'Stephen King', 'Akiva Goldsman', 'Ron Howard', 'Erica Huggins', 'Tom Holkenborg', 'Rasmus Videbæk', 'Alan Edward Bell', 'Dan Zimmerman', 'Christopher Glass', 'Oliver Scholl']"
"$181,705",Buddies in India,China Lion Film Distribution,"January 27, 2017 (EMEA, Domestic)",,1 hr 39 min,Action Comedy,"In an effort to save his house, a man accompanies the son of a recently deceased CEO to India to recover his will.","['Baoqiang Wang', 'Yan Liu', 'White-K', 'Vikramjeet Virk']","['Baoqiang Wang', 'Ding Ding', 'Baoqiang Wang', 'Muchun Zha', 'R.S. Mani', 'Sunny Subramanian']"
"$185,546",Along With the Gods: The Two Worlds,Well Go USA Entertainment,"December 20, 2017 (South Korea)",,2 hr 19 min,Action Adventure Drama Fantasy Thriller,"After a heroic death, a firefighter navigates the afterlife with the help of three guides.","['Ha Jung-woo', 'Cha Tae-hyun', 'Ju Ji-hoon', 'Kim Hyang-gi']","['Yong-hwa Kim', 'Ho-min Ju', 'Yong-hwa Kim', 'Ji-sun Choi', 'Jun-seok Bang', 'Kim Byung-seo', 'Hye-jin Kim', 'Zino Kim', 'Nam Na-young', 'Mok-won Lee']"
,Immortal Demon Slayer,,"July 13, 2017 (APAC, China)",,2 hr 3 min,Action Adventure Family Fantasy,"A giant rebelled against the heavens. It was declared a devil and defeated. The immortal heart evolved into Sun Wukong. The heavens found him, and ravaged his home. He enters the heavenly kingdom, disguised as a human, seeking retribution.","['Eddie Peng', 'Shawn Yue', 'Ni Ni', 'Xiao Bai']","['Chi-Kin Kwok', 'Wenwen Fan', 'Hai Huang', 'Hezai Jin', 'Chi-Kin Kwok', 'Henri Wong', 'Jianxin Huang', 'Ivy Kong', 'Wenyang Liu', 'Ning Ren', 'Wan Pin Chu', 'Jason Kwan', 'Matthew Hui', 'Che Kiu Lam']"
"$16,640,452",Jigsaw,Lionsgate Films,"October 25, 2017 (Egypt)",R,1 hr 32 min,,"Bodies are turning up around the city, each having met a uniquely gruesome demise. As the investigation proceeds, evidence points to one suspect: John Kramer, the man known as Jigsaw, who has been dead for over 10 years.","['Matt Passmore', 'Tobin Bell', 'Callum Keith Rennie', 'Hannah Emily Anderson']","['Michael Spierig', 'Peter Spierig', 'Josh Stolberg', 'Pete Goldfinger', 'Mark Burg', 'Gregg Hoffman', 'Oren Koules', 'Charlie Clouser', 'Ben Nott', 'Kevin Greutert', 'Anthony Cowley']"
"$12,501,936",Life,Sony Pictures Releasing,"March 22, 2017 (APAC, EMEA)",R,1 hr 44 min,,A team of scientists aboard the International Space Station discover a rapidly evolving life form that caused extinction on Mars and now threatens all life on Earth.,"['Jake Gyllenhaal', 'Rebecca Ferguson', 'Ryan Reynolds', 'Hiroyuki Sanada']","['Daniel Espinosa', 'Rhett Reese', 'Paul Wernick', 'Bonnie Curtis', 'David Ellison', 'Dana Goldberg', 'Julie Lynn', 'Jon Ekstrand', 'Seamus McGarvey', 'Mary Jo Markey', 'Frances Parker', 'Nigel Phelps']"
"$18,286,420",Atomic Blonde,Focus Features,"July 26, 2017 (APAC, EMEA)",R,1 hr 55 min,,An undercover MI6 agent is sent to Berlin during the Cold War to investigate the murder of a fellow agent and recover a missing list of double agents.,"['Charlize Theron', 'James McAvoy', 'John Goodman', 'Eddie Marsan']","['David Leitch', 'Kurt Johnstad', 'Antony Johnston', 'Sam Hart', 'A.J. Dix', 'Eric Gitter', 'Beth Kono', 'Kelly McCormick', 'Peter Schwerin', 'Charlize Theron', 'Tyler Bates', 'Jonathan Sela', 'Elísabet Ronaldsdóttir', 'David Scheunemann']"
,Legend of the Demon Cat,,"December 21, 2017 (Australia)",,2 hr 9 min,Adventure Drama Family Fantasy,"When a demon cat appears and breaks the peace of Chang'an City, causing a series of strange events, poet Bai Letian and monk Kukai join hands to investigate the death of the emperor's concubine by following the trail left by the cat.","['Xuan Huang', 'Shôta Sometani', 'Yuqi Zhang', 'Hao Qin']","['Kaige Chen', 'Baku Yumemakura', 'Kaige Chen', 'Hui-Ling Wang', 'Shirley Kao', 'Klaus Badelt', 'Anne-Kathrin Dern', 'Misha Segal', 'Yu Cao', 'Wei Lu', 'Nan Tu']"
"$16,172,119",The Shack,Lionsgate Films,"March 1, 2017 (Philippines)",PG-13,2 hr 12 min,Drama Fantasy,"A grieving man receives a mysterious, personal invitation to meet with God at a place called ""The Shack.""","['Sam Worthington', 'Octavia Spencer', 'Tim McGraw', 'Radha Mitchell']","['Stuart Hazeldine', 'John Fusco', 'Andrew Lanham', 'Destin Daniel Cretton', 'William P. Young', 'Wayne Jacobsen', 'Brad Cummings', 'Brad Cummings', 'Gil Netter', 'Aaron Zigman', 'Declan Quinn', 'William Steinkamp', 'Joseph C. Nemec III']"
"$138,346",Chasing the Dragon,Well Go USA Entertainment,"September 29, 2017 (Domestic)",,2 hr 8 min,Action Biography Crime History,"An illegal immigrant from Mainland China sneaks into corrupt British-colonized Hong Kong in 1963, transforming himself into a ruthless and emerging drug lord.","['Donnie Yen', 'Andy Lau', 'Philip Keung', 'Wilfred Lau']","['Jason Kwan', 'Jing Wong', 'Aman Chang', 'Koon-Nam Lui', 'Jing Wong', 'Ming-Ho Yip', 'Andy Lau', 'Connie Wong', 'Donnie Yen', 'Kwong Wing Chan', 'Patrick Lui', 'Jason Kwan', 'Ka-Wing Li']"
"$1,787,108",Tiger Zinda Hai,Yash Raj Films,"December 21, 2017 (APAC, EMEA)",,2 hr 41 min,Action Adventure Thriller,"Inspired by real events, Tiger Zinda Hai is a sequel to the blockbuster Ek Tha Tiger, and an espionage action drama that follows a daring rescue mission in Iraq.","['Salman Khan', 'Katrina Kaif', 'Paresh Rawal', 'Anupriya Goenka']","['Ali Abbas Zafar', 'Neelesh Misra', 'Ali Abbas Zafar', 'Ali Abbas Zafar', 'Aditya Chopra', 'Ali Abbas Zafar', 'Aditya Chopra', 'Vishal Dadlani', 'Julius Packiam', 'Shekhar Ravjiani', 'Marcin Laskawiec', 'Rameshwar S. Bhagat', 'Rajnish Hedao']"
"$331,854",A Taxi Driver,Well Go USA Entertainment,"August 2, 2017 (South Korea)",,2 hr 17 min,Action Drama History,"A widowed father and taxi driver who drives a German reporter from Seoul to Gwangju to cover the 1980 uprising, soon finds himself regretting his decision after being caught in the violence around him.","['Song Kang-ho', 'Thomas Kretschmann', 'Yoo Hae-jin', 'Ryu Jun-Yeol']","['Hun Jang', 'Yu-na Eom', 'Eun-Kyung Park', 'Cho Young-wuk', 'Nak-seon Go', 'Kim Jae-beom', 'Kim Sang-beom', 'Jo Hwa-seong', 'Yi-jin Jeong']"
"$11,932,330",Going in Style,Warner Bros.,"April 6, 2017 (11 markets)",PG-13,1 hr 36 min,,"Desperate to pay the bills and come through for their loved ones, three lifelong pals risk it all by embarking on a daring bid to knock off the very bank that absconded with their money.","['Michael Caine', 'Alan Arkin', 'Ann-Margret', 'Matt Dillon']","['Zach Braff', 'Theodore Melfi', 'Edward Cannon', 'Donald De Line', 'Rob Simonsen', 'Rodney Charters', 'Myron Kerstein', 'Anne Ross']"
"$13,002,632",Rings,Paramount Pictures,"February 1, 2017 (EMEA)",PG-13,1 hr 42 min,,A young woman finds herself on the receiving end of a terrifying curse that threatens to take her life in 7 days.,"['Matilda Anna Ingrid Lutz', 'Alex Roe', 'Johnny Galecki', ""Vincent D'Onofrio""]","['F. Javier Gutiérrez', 'David Loucka', 'Jacob Estes', 'Akiva Goldsman', 'David Loucka', 'Jacob Estes', 'Kôji Suzuki', 'Laurie MacDonald', 'Walter F. Parkes', 'Matthew Margeson', 'Sharone Meir', 'Steve Mirkovich', ""Jeremiah O'Driscoll"", 'Kevin Kavanaugh']"
"$249,933",Once Upon A Time,Well Go USA Entertainment,"August 3, 2017 (China)",,1 hr 49 min,Adventure Drama Fantasy Romance,"Bai Qian is a Queen who lives in a Peach Blossom forest. Suffering from memory loss, she is invited to a party where she encounters people who recognize her. Her lover, Ye Hua had been searching for her, and now he must win her love back.","['Liu Yifei', 'Yang Yang', 'Xingxu Chen', 'Marissa Cohen']","['Anthony LaMolinara', 'Xiaoding Zhao', 'Shane Comley-White', 'Qi Tang', 'Qi Tang', 'Chen Gao', 'Zhilei Sa', 'Xiaoding Zhao']"
,Paradox,,"August 17, 2017 (China)",,1 hr 41 min,Action Adventure Crime Thriller,A tough Hong Kong cop's 16 y.o. daughter disappears in Pattaya. He goes to Thailand to find her and must deal with corrupt cops but an honest one helps him track down culprits involved in illegal organ trafficking.,"['Louis Koo', 'Yue Wu', 'Ka-Tung Lam', 'Chris Collins']","['Wilson Yip', 'Nick Cheuk', 'Lai-Yin Leung', 'Soi Cheang', 'Paco Wong', 'Ken Chan', 'Kwong Wing Chan', 'Kenny Tse', 'Hoi Wong', 'Kwok-Keung Mak']"
"$364,437",Lady Bird,A24,"November 3, 2017 (Domestic)",R,1 hr 34 min,Comedy Drama,"In 2002, an artistically inclined 17-year-old girl comes of age in Sacramento, California.","['Saoirse Ronan', 'Laurie Metcalf', 'Tracy Letts', 'Lucas Hedges']","['Greta Gerwig', 'Greta Gerwig', 'Eli Bush', ""Evelyn O'Neill"", 'Scott Rudin', 'Jon Brion', 'Sam Levy', 'Nick Houy', 'Chris Jones']"
,Fantastica: A Boonie Bears Adventure,,"January 28, 2017 (China)",,1 hr 29 min,Action Adventure Animation Comedy Family,Boonie bears and Bald Qiang work together with secret primitive girl to smash a conspiracy to destroy old-growth forest.,"['Mario Lopez', 'Josh Peck', 'Joseph S. Lambert', 'Hanna Allsaar']","['Leon Ding', 'Huida Lin', 'Yongchang Lin', 'Leon Ding', 'Qin Wan', 'Rachel Xu', 'Victor Elizalde', 'Ning Lin', 'Daisy Shang', 'Dan Yang']"
"$8,342,311",The Nut Job 2: Nutty by Nature,Open Road Films (II),"August 10, 2017 (APAC, EMEA)",PG,1 hr 31 min,,A group of squirrels try to stop a mayor from destroying the park where they live to make way for a dysfunctional amusement park.,"['Will Arnett', 'Maya Rudolph', 'Bobby Cannavale', 'Bobby Moynihan']","['Cal Brunker', 'Scott Bindley', 'Cal Brunker', 'Bob Barlen', 'Peter Lepeniotis', 'Bob Barlen', 'Jong Han Kim', 'Jongsoo Kim', 'Sunghwan Kim', 'Youngki Lee', 'Harry Linden', 'Lili Ma', 'Heitor Pereira', 'Paul Hunter']"
"$14,846,778",American Assassin,Lionsgate Films,"September 13, 2017 (EMEA, APAC)",R,1 hr 51 min,,"After the death of his girlfriend at the hands of terrorists, Mitch Rapp is drawn into the world of counterterrorism, mentored by tough-as-nails former U.S. Navy S.E.A.L. Stan Hurley.","[""Dylan O'Brien"", 'Michael Keaton', 'Sanaa Lathan', 'Taylor Kitsch']","['Michael Cuesta', 'Stephen Schiff', 'Michael Finch', 'Edward Zwick', 'Marshall Herskovitz', 'Vince Flynn', 'Lorenzo di Bonaventura', 'Nick Wechsler', 'Steven Price', 'Enrique Chediak', 'Conrad Buff IV', 'Andrew Laws']"
"$158,845",Victoria & Abdul,Focus Features,"September 13, 2017 (Egypt)",PG-13,1 hr 51 min,Biography Comedy Drama History,Queen Victoria strikes up an unlikely friendship with a young Indian clerk named Abdul Karim.,"['Judi Dench', 'Ali Fazal', 'Tim Pigott-Smith', 'Eddie Izzard']","['Stephen Frears', 'Lee Hall', 'Shrabani Basu', 'Tim Bevan', 'Eric Fellner', 'Beeban Kidron', 'Tracey Seaward', 'Thomas Newman', 'Danny Cohen', 'Melanie Oliver', 'Alan Macdonald']"
,Suck Me Shakespeer 3,,"October 26, 2017 (Germany)",,2 hr,Comedy,A bank robber becomes a teacher after being released from prison and finds himself at the center of a number of crazy adventures.,"[""Elyas M'Barek"", 'Jella Haase', 'Sandra Hüller', 'Katja Riemann']","['Bora Dagtekin', 'Bora Dagtekin', 'Nicole Springstubbe', 'Djorkaeff', 'Vincent Stein', 'Markus Nestroy', 'Charles Ladmiral', 'Constantin von Seld', 'Eva Stiebler']"
,Detective Conan: Crimson Love Letter,,"April 15, 2017 (Japan)",,1 hr 52 min,Action Adventure Animation Crime Family Mystery Thriller,"A bombing case at Nichiuri TV in autumn. The Satsuki Cup, which crowns the winner of Japan's Hyakunin Isshu, is currently being filmed inside the facility. The incident results in a big commotion and, while the building is burning to ashes, the only people left inside are Hattori and Toyama Kazuha . They get rescued just in time by Conan , who rushes to the scene. Both the identity and purposes of the bomber are unknown. While confusion takes over due to the explosion, Conan meets a mysterious beautiful girl who claims she is ""Heiji's fiancée"". Her name is Momiji Ooka and she is the Kyoto High School champion of karuta game. As fate would have it, Kazuha is going to face Momiji in the Hyakunin Isshu, so she begins to train with the help of Heiji's mother, Shizuoka ,who is a skilled Karuta player. At the same time, in a Japanese house in Arashiyama Kyoto's outskirts, the reigning Satsuki Cup champion is murdered. Pictures of the crime scene reveal Momji's presence. Additionally, several Karuta cards were spread around the victim. Conan and Heiji, along with the Osaka and Kyoto police departments, begin their investigation on the Satsuki Cup and the related murder case. As the inquiry goes on, they come across a secret connected with the Hyakunin Isshu.","['Cristina Valenzuela', 'Erika Harlacher', 'Erica Mendez', 'Ryan Bartley']","['Kôbun Shizuno', 'Gôshô Aoyama', ""Jun'ichi Iioka"", 'Takahiro Ôkura', 'Keiichi Ishiyama', 'Shûhô Kondô', 'Sam Maseba', 'Eric P. Sherman', 'Isato Yonekura', 'Katsuo Ôno', 'Hitoshi Nishiyama', 'Terumitsu Okada']"
"$10,551,336",The Mountain Between Us,Twentieth Century Fox,"October 4, 2017 (Jamaica)",PG-13,1 hr 52 min,,"Stranded after a tragic plane crash, two strangers must forge a connection to survive the extreme elements of a remote snow-covered mountain. When they realize help is not coming, they embark on a perilous journey across the wilderness.","['Kate Winslet', 'Idris Elba', 'Beau Bridges', 'Dermot Mulroney']","['Hany Abu-Assad', 'Chris Weitz', 'J. Mills Goodloe', 'Charles Martin', 'Peter Chernin', 'Dylan Clark', 'David Ready', 'Jenno Topping', 'Ramin Djawadi', 'Mandy Walker', 'Lee Percy', 'Patrice Vermette']"
"$9,812,674",The Star,Sony Pictures Releasing,"November 15, 2017 (France)",PG,1 hr 26 min,,A small but brave donkey and his animal friends become the unsung heroes of the first Christmas.,"['Steven Yeun', 'Keegan-Michael Key', 'Aidy Bryant', 'Gina Rodriguez']","['Timothy Reckart', 'Carlos Kotkin', 'Simon Moore', 'Carlos Kotkin', 'Jennifer Magee-Cook', 'John Paesano', 'Pam Ziegenhagen', 'Craig Elliott']"
"$12,252,439",How to Be a Latin Lover,Pantelion Films,"April 27, 2017 (Slovenia)",PG-13,1 hr 55 min,Comedy Drama,"Finding himself dumped after twenty-five years of marriage, a man who made a career of seducing rich older women must move in with his estranged sister, where he begins to learn the value of family.","['Eugenio Derbez', 'Salma Hayek', 'Raphael Alejandro', 'Rob Lowe']","['Ken Marino', 'Jon Zack', 'Chris Spain', 'Eugenio Derbez', 'Ben Odell', 'Craig Wedren', 'John Bailey', 'John Daigle', 'Marcia Hinds']"
"$11,205,561",47 Meters Down,Entertainment Studios Motion Pictures,"May 25, 2017 (Italy)",PG-13,1 hr 29 min,,"Two sisters vacationing in Mexico are trapped in a shark cage at the bottom of the ocean. With less than an hour of oxygen left and great white sharks circling nearby, they must fight to survive.","['Mandy Moore', 'Claire Holt', 'Matthew Modine', 'Chris Johnson']","['Johannes Roberts', 'Johannes Roberts', 'Ernest Riera', 'James Harris', 'Mark Lane', 'tomandandy', 'Mark Silk', 'Martin Brinkler', 'David Bryan']"
"$11,727,390","Everything, Everything",Warner Bros.,"May 18, 2017 (United Arab Emirates)",PG-13,1 hr 36 min,,A teenager who's spent her whole life confined to her home falls for the boy next door.,"['Amandla Stenberg', 'Nick Robinson', 'Anika Noni Rose', 'Ana de la Reguera']","['Stella Meghie', 'J. Mills Goodloe', 'Nicola Yoon', 'Elysa Koplovitz Dutton', 'Leslie Morgenstein', 'Ludwig Göransson', 'Igor Jadue-Lillo', 'Nancy Richardson', 'Charisse Cardenas']"
