,Rank,Worldwide,Domestic,Name,Domestic Distributor,Earliest Release date,Earliest Release region,MPAA,Running Time,Genres,Overview,Actors,Film makers
343,19,220889446.0,116987516,Jungle Cruise,Walt Disney Studios Motion Pictures,"July 28, 2021",EMEA,PG-13,2 hr 7 min,"['Action', 'Adventure', 'Comedy', 'Fantasy']",Based on Disneyland's theme park ride where a small riverboat takes a group of travelers through a jungle filled with dangerous animals and reptiles but with a supernatural element.,"['Dwayne Johnson', 'Emily Blunt', 'Edgar Ramírez', 'Jack Whitehall']","['Jaume Collet-Serra', 'Michael Green', 'Glenn Ficarra', 'John Requa', 'John Norville', 'Josh Goldstein', 'Glenn Ficarra', 'John Requa', 'John Davis', 'Beau Flynn', 'John Fox', 'Dany Garcia', 'Hiram Garcia', 'Dwayne Johnson', 'James Newton Howard', 'Flavio Martínez Labiano', 'Joel Negron', 'Jean-Vincent Puzos']"
344,20,206431050.0,65631050,The Conjuring: The Devil Made Me Do It,Warner Bros.,"May 26, 2021",Egypt,R,1 hr 52 min,"['Horror', 'Mystery', 'Thriller']","Arne Cheyenne Johnson stabs and murders his landlord, claiming to be under demonic possession while Ed and Lorraine Warren investigate the case and try to prove his innocence.","['Patrick Wilson', 'Vera Farmiga', ""Ruairi O'Connor"", 'Sarah Catherine Hook']","['Michael Chaves', 'David Leslie Johnson-McGoldrick', 'James Wan', 'David Leslie Johnson-McGoldrick', 'Chad Hayes', 'Carey W. Hayes', 'Peter Safran', 'James Wan', 'Joseph Bishara', 'Michael Burgess', 'Peter Gvozdas', 'Christian Wagner', 'Jennifer Spence']"
345,21,205842393.0,385305,Raging Fire,Well Go USA Entertainment,"July 30, 2021",China,G,2 hr 6 min,"['Action', 'Adventure', 'Crime', 'Mystery', 'Thriller']","Bong is a hardline cop with a long history of success, but his past comes back to haunt him when a sting is attacked by a group led by his former protégé, a man set on destroying everyone who ever wronged him.","['Donnie Yen', 'Nicholas Tse', 'Lan Qin', 'Angus Yeung']","['Benny Chan', 'Shane Comley-White', 'Benny Chan', 'Ryan Wai-Chun Ling', 'Yaoliang Tang', 'Benny Chan', 'Donnie Yen', 'Nicolas Errèra', 'Yuen-Man Fung', 'Curran Pang']"
346,22,204334455.0,129360575,Ghostbusters: Afterlife,Sony Pictures Releasing,"November 18, 2021",7 markets,PG-13,2 hr 4 min,"['Adventure', 'Comedy', 'Fantasy', 'Sci-Fi']","When a single mom and her two kids arrive in a small town, they begin to discover their connection to the original Ghostbusters and the secret legacy their grandfather left behind.","['Carrie Coon', 'Paul Rudd', 'Finn Wolfhard', 'Mckenna Grace']","['Jason Reitman', 'Gil Kenan', 'Jason Reitman', 'Ivan Reitman', 'Dan Aykroyd', 'Harold Ramis', 'Ivan Reitman', 'Rob Simonsen', 'Eric Steelberg', 'Dana E. Glauberman', 'Nathan Orloff', 'François Audouy']"
347,24,181325565.0,152972,Cliff Walkers,CMC Pictures,"April 29, 2021",New Zealand,G,2 hr,"['Crime', 'Drama', 'Thriller']","In the puppet state of Manchukuo in the 1930s, four Communist party special agents, after returning to China, embark on a secret mission. Sold out by a traitor, the team find themselves surrounded by threats on all sides.","['Hewei Yu', 'Yi Zhang', 'Hailu Qin', 'Haocun Liu']","['Zhuang Jie Qiong', 'Yimou Zhang', 'Yongxian Quan', 'Yimou Zhang', 'Yiran Pan', 'Yongxian Quan', 'Luca Liang', 'Liwei Pang', 'Cho Young-wuk', 'Xiaoding Zhao', 'Yongyi Li', 'Mu Lin']"
348,26,166760828.0,34542754,Jujutsu Kaisen 0,Crunchyroll,"December 24, 2021",Japan,PG-13,1 hr 45 min,"['Action', 'Animation', 'Fantasy']","The prequel to Jujutsu Kaisen, where a high schooler gains control of an extremely powerful cursed spirit and gets enrolled in the Tokyo Prefectural Jujutsu High School by Jujutsu Sorcerers.","['Chinatsu Akasaki', 'Aya Endô', 'Kana Hanazawa', 'Show Hayami']","['Sunghoo Park', 'Gege Akutami', 'Hiroshi Seko', 'Alisa Okehazama', 'Yoshimasa Terui', 'Hiroaki Tsutsumi', 'Teppei Ito', 'Keisuke Yanagi']"
349,27,163692228.0,70592228,Space Jam: A New Legacy,Warner Bros.,"July 10, 2021",Russia/CIS,PG,1 hr 55 min,"['Adventure', 'Animation', 'Comedy', 'Family', 'Fantasy', 'Sci-Fi', 'Sport']","A rogue artificial intelligence kidnaps the son of famed basketball player LeBron James, who then has to work with Bugs Bunny to win a basketball game.","['LeBron James', 'Don Cheadle', 'Cedric Joe', 'Khris Davis']","['Malcolm D. Lee', 'Leo Benvenuti', 'Steve Rudnick', 'Timothy Harris', 'Herschel Weingrod', 'Juel Taylor', 'Tony Rettenmaier', 'Keenan Coogler', 'Terence Nance', 'Juel Taylor', 'Tony Rettenmaier', 'Keenan Coogler', 'Terence Nance', 'Jesse Gordon', 'Celeste Ballard', 'Maverick Carter', 'Ryan Coogler', 'Duncan Henderson', 'LeBron James', 'Kris Bowers', 'Salvatore Totino', 'Bob Ducsay', 'Devin Crane', 'Akin McKenzie', 'Clint Wallace']"
350,28,157386805.0,37686805,The Matrix Resurrections,Warner Bros.,"December 10, 2021",Mexico,R,2 hr 28 min,"['Action', 'Sci-Fi']","Return to a world of two realities: one, everyday life; the other, what lies behind it. To find out if his reality is a construct, to truly know himself, Mr. Anderson will have to choose to follow the white rabbit once more.","['Keanu Reeves', 'Carrie-Anne Moss', 'Yahya Abdul-Mateen II', 'Jonathan Groff']","['Lana Wachowski', 'Lana Wachowski', 'David Mitchell', 'Aleksandar Hemon', 'Lilly Wachowski', 'Lana Wachowski', 'Grant Hill', 'James McTeigue', 'Lana Wachowski', 'Johnny Klimek', 'Tom Tykwer', 'Daniele Massaccesi', 'John Toll', 'Joseph Jett Sally', 'Hugh Bateup', 'Peter Walpole']"
351,29,153901717.0,40501717,Peter Rabbit 2: The Runaway,Sony Pictures Releasing,"March 26, 2021",Australia,PG,1 hr 33 min,"['Adventure', 'Animation', 'Comedy', 'Drama', 'Family', 'Fantasy']","Thomas and Bea are now married and living with Peter and his rabbit family. Bored of life in the garden, Peter goes to the big city, where he meets shady characters and ends up creating chaos for the whole family.","['Rose Byrne', 'Domhnall Gleeson', 'David Oyelowo', 'James Corden']","['Will Gluck', 'Will Gluck', 'Patrick Burleigh', 'Beatrix Potter', 'Catherine Bishop', 'Will Gluck', 'Jodi Hildebrand', 'Zareh Nalbandian', 'Dominic Lewis', 'Peter Menzies Jr.', 'Matt Villa', 'Roger Ford']"
352,30,153269161.0,53809574,House of Gucci,United Artists Releasing,"November 24, 2021","Domestic, EMEA",R,2 hr 38 min,"['Biography', 'Crime', 'Drama']","When Patrizia Reggiani, an outsider from humble beginnings, marries into the Gucci family, her unbridled ambition begins to unravel their legacy and triggers a reckless spiral of betrayal, decadence, revenge, and ultimately...murder.","['Lady Gaga', 'Adam Driver', 'Al Pacino', 'Jeremy Irons']","['Ridley Scott', 'Becky Johnston', 'Roberto Bentivegna', 'Becky Johnston', 'Sara Gay Forden', 'Giannina Facio', 'Mark Huffam', 'Ridley Scott', 'Kevin J. Walsh', 'Harry Gregson-Williams', 'Dariusz Wolski', 'Claire Simpson', 'Arthur Max']"
353,31,150123320.0,160013,A Writer's Odyssey,CMC Pictures,"January 12, 2021",New Zealand,G,2 hr 10 min,"['Action', 'Adventure', 'Fantasy', 'Mystery']","Six years after the abduction of his daughter, a man is hired to kill the author of a fantasy novel, but the world of the novel seems to intersect with reality.","['Jiayin Lei', 'Mi Yang', 'Zijian Dong', 'Shengdi Wang']","['Yang Lu', 'Zhuang Jie Qiong', 'Shu Chen', 'Yang Yu', 'Haiyan Qin', 'Yang Lu', 'Xuetao Shuang', 'Shuang Xuetao', 'Lu Yang', 'Chen Shu', 'Shuang Xue Tao', 'Xiaocao Liu', 'Frant Gwo', 'Ning Hao', 'Wusheng Jiang', 'Juan Wan', 'Ning Zhang', 'Rao Xiao Zhi', 'Jin Da Zhou', 'Jed Kurzel', 'Jed Kurzel', 'Qiming Han', 'Han Qi Ming', 'Lin Zhu', 'Liyun Zhu']"
354,32,146745280.0,57300280,The Boss Baby 2: Family Business,Universal Pictures,"July 1, 2021",Ukraine,PG,1 hr 47 min,"['Adventure', 'Animation', 'Comedy', 'Family', 'Fantasy']","The Templeton brothers have become adults and drifted away from each other, but a new boss baby with a cutting-edge approach is about to bring them together again - and inspire a new family business.","['Alec Baldwin', 'James Marsden', 'Amy Sedaris', 'Ariana Greenblatt']","['Tom McGrath', 'Michael McCullers', 'Tom McGrath', 'Michael McCullers', 'Marla Frazee', 'Jeff Hermann', 'Steve Mazzaro', 'Hans Zimmer', 'Mary Blee', 'Mark A. Hester', 'Raymond Zibach']"
355,33,144327371.0,40127371,PAW Patrol: The Movie,Paramount Pictures,"August 11, 2021",EMEA,G,1 hr 26 min,"['Action', 'Adventure', 'Animation', 'Comedy', 'Crime', 'Family', 'Sci-Fi']",Ryder and the PAW Patrol pups are called to Adventure City in order to stop the recently-elected Mayor Humdinger from wreaking havoc.,"['Tyler Perry', 'Ron Pardo', 'Will Brisbin', 'Kingsley Marshall']","['Cal Brunker', 'Billy Frolick', 'Cal Brunker', 'Bob Barlen', 'Billy Frolick', 'Keith Chapman', 'Jennifer Dodge', 'Heitor Pereira', 'Ed Fuller', 'Mirenda Ouellet', 'Jerrad Pulham']"
356,34,136536687.0,46536687,Tom & Jerry,Warner Bros.,"February 11, 2021",4 markets,PG,1 hr 41 min,"['Adventure', 'Animation', 'Comedy', 'Family', 'Fantasy']","A chaotic battle ensues between Jerry Mouse, who has taken refuge in the Royal Gate Hotel, and Tom Cat, who is hired to drive him away before the day of a big wedding arrives.","['Chloë Grace Moretz', 'Michael Peña', 'Colin Jost', 'Tom']","['Tim Story', 'William Hanna', 'Joseph Barbera', 'Kevin Costello', 'Christopher DeFaria', 'Christopher Lennertz', 'Alan Stewart', 'Peter S. Elliot', 'James Hambidge']"
357,37,130423032.0,54723032,Raya and the Last Dragon,Walt Disney Studios Motion Pictures,"March 3, 2021","EMEA, APAC",PG,1 hr 47 min,"['Action', 'Adventure', 'Animation', 'Comedy', 'Drama', 'Family', 'Fantasy']","In a realm known as Kumandra, a re-imagined Earth inhabited by an ancient civilization, a warrior named Raya is determined to find the last dragon.","['Kelly Marie Tran', 'Awkwafina', 'Gemma Chan', 'Izaac Wang']","['Don Hall', 'Carlos López Estrada', 'Paul Briggs', 'John Ripa', 'Qui Nguyen', 'Adele Lim', 'Paul Briggs', 'Don Hall', 'Adele Lim', 'Carlos López Estrada', 'Kiel Murray', 'Qui Nguyen', 'John Ripa', 'Dean Wellins', 'Peter Del Vecho', 'Osnat Shurer', 'James Newton Howard', 'Rob Dressel', 'Fabienne Rawley', 'Shannon Stein', 'Helen Mingjue Chen', 'Paul A. Felix', 'Cory Loftis']"
358,39,125897478.0,37176373,The King's Man,20th Century Studios,"December 22, 2021",4 markets,R,2 hr 11 min,"['Action', 'Adventure', 'Thriller']","In the early years of the 20th century, the Kingsman agency is formed to stand against a cabal plotting a war to wipe out millions.","['Ralph Fiennes', 'Gemma Arterton', 'Rhys Ifans', 'Harris Dickinson']","['Matthew Vaughn', 'Matthew Vaughn', 'Karl Gajdusek', 'Matthew Vaughn', 'Mark Millar', 'Dave Gibbons', 'Adam Bohling', 'David Reid', 'Matthew Vaughn', 'Dominic Lewis', 'Matthew Margeson', 'Ben Davis', 'Jason Ballantine', 'Robert Hall', 'Darren Gilford']"
359,40,119815153.0,56489153,The Addams Family 2,United Artists Releasing,"October 1, 2021",Domestic,PG,1 hr 33 min,"['Adventure', 'Animation', 'Comedy', 'Family', 'Fantasy', 'Horror']","The Addams get tangled up in more wacky adventures and find themselves involved in hilarious run-ins with all sorts of unsuspecting characters. Sequel to the 2019 animated film, 'The Addams Family'.","['Oscar Isaac', 'Charlize Theron', 'Chloë Grace Moretz', ""Javon 'Wanna' Walton""]","['Conrad Vernon', 'Greg Tiernan', 'Laura Brousseau', 'Kevin Pavlovic', 'Dan Hernandez', 'Benji Samit', 'Ben Queen', 'Susanna Fogel', 'Dan Hernandez', 'Benji Samit', 'Charles Addams', 'Gail Berman', 'Adam Brainin', 'Brian Briskman', 'Kate Enge', ""Alison O'Brien"", 'Danielle Sterling', 'Conrad Vernon', 'Jeff Danna', 'Mychael Danna', 'Ryan Folsey', 'Scott Winlaw', 'Patricia Atchison']"
360,41,116720921.0,86252,My Love,CMC Pictures,"April 30, 2021",China,G,1 hr 55 min,"['Comedy', 'Romance']","During high school, Zhou Xiaoqi fell in love with You Yongci at first sight, but he watched over her secretly and the girl left without saying goodbye. Now it is 15 years later and he still pines for her.","['Greg Han Hsu', 'Ruonan Zhang', 'Guansen Ding', 'Zidong Yan']","['Tian Han', 'Shuang He']"
361,42,107347356.0,48947356,Clifford the Big Red Dog,Paramount Pictures,"November 10, 2021",Domestic,PG,1 hr 36 min,"['Adventure', 'Comedy', 'Family', 'Fantasy']",A young girl's love for a tiny puppy named Clifford makes the dog grow to an enormous size.,"['Darby Camp', 'Jack Whitehall', 'Izaac Wang', 'John Cleese']","['Walt Becker', 'Jay Scherick', 'David Ronn', 'Blaise Hemingway', 'Justin Malen', 'Ellen Rapoport', 'Norman Bridwell', 'Jordan Kerner', 'Iole Lucchese', 'John Debney', 'Peter Lyons Collister', 'Sabrina Plisco', 'Naomi Shohan']"
362,43,103966489.0,27466489,Wrath of Man,United Artists Releasing,"April 22, 2021",Russia/CIS,R,1 hr 59 min,"['Action', 'Crime', 'Thriller']",A cold and mysterious character working at a cash truck company responsible for moving a lot of money around Los Angeles each week.,"['Jason Statham', 'Holt McCallany', 'Josh Hartnett', 'Rocci Boy Williams']","['Guy Ritchie', 'Nicolas Boukhrief', 'Éric Besnard', 'Guy Ritchie', 'Ivan Atkinson', 'Marn Davies', 'Ivan Atkinson', 'Bill Block', 'Guy Ritchie', 'Christopher Benstead', 'Alan Stewart', 'James Herbert', 'Martyn John']"
363,45,93882453.0,810744,Evangelion: 3.0+1.01 Thrice Upon a Time,Fathom Events,"March 8, 2021",Japan,G,2 hr 34 min,"['Action', 'Animation', 'Drama', 'Sci-Fi']","Misato and her anti-NERV group WILLE arrive in Paris, a city now red from core-ization. Crew from the flagship Wunder land on a containment tower.","['Megumi Ogata', 'Megumi Hayashibara', 'Yûko Miyamura', 'Akira Ishida']","['Mahiro Maeda', 'Katsuichi Nakayama', 'Kazuya Tsurumaki', 'Hideaki Anno', 'Joe Fria', 'Hideaki Anno', 'Hideaki Anno', 'Hideaki Anno', 'Shirô Sagisu', 'Tôru Fukushi', 'Emi Tsujita']"
364,46,91824961.0,23149,End Game,CMC Pictures,"February 12, 2021","APAC, China",G,1 hr 59 min,"['Action', 'Comedy', 'Crime', 'Drama', 'Romance']","When an assassin loses his memory, an unsuccessful actor exchanges identities with him.","['Andy Lau', 'Yang Xiao', 'Regina Wan', 'Yi Cheng']","['Xiaozhi Rao', 'Xiang Fan', 'Xiang Li', 'Xiaozhi Rao', 'Kenji Uchida', 'Ou Ge Deng', 'Ni Liao']"
365,47,90146510.0,48276510,Old,Universal Pictures,"July 21, 2021",EMEA,PG-13,1 hr 48 min,"['Drama', 'Horror', 'Mystery', 'Thriller']","A vacationing family discovers that the secluded beach where they're relaxing for a few hours is somehow causing them to age rapidly, reducing their entire lives into a single day.","['Gael García Bernal', 'Vicky Krieps', 'Rufus Sewell', 'Alex Wolff']","['M. Night Shyamalan', 'M. Night Shyamalan', 'Pierre-Oscar Lévy', 'Frederik Peeters', 'Marc Bienstock', 'Ashwin Rajan', 'M. Night Shyamalan', 'Trevor Gureckis', 'Mike Gioulakis', 'Brett M. Reed', 'Naaman Marshall']"
366,48,84426031.0,42326031,Mortal Kombat,Warner Bros.,"April 8, 2021","EMEA, APAC",R,1 hr 50 min,"['Action', 'Adventure', 'Fantasy', 'Sci-Fi', 'Thriller']",MMA fighter Cole Young seeks out Earth's greatest champions in order to stand against the enemies of Outworld in a high stakes battle for the universe.,"['Lewis Tan', 'Jessica McNamee', 'Josh Lawson', 'Joe Taslim']","['Simon McQuoid', 'Greg Russo', 'Dave Callaham', 'Oren Uziel', 'Greg Russo', 'Ed Boon', 'John Tobias', 'Todd Garner', 'Simon McQuoid', 'E. Bennett Walsh', 'James Wan', 'Benjamin Wallfisch', 'Germain McMicking', 'Scott Gray', 'Dan Lebental', 'Naaman Marshall']"
367,50,77411570.0,61186570,Candyman,Universal Pictures,"August 26, 2021",17 markets,R,1 hr 31 min,"['Horror', 'Thriller']",A sequel to the horror film Candyman that returns to the now-gentrified Chicago neighborhood where the legend began.,"['Yahya Abdul-Mateen II', 'Teyonah Parris', 'Nathan Stewart-Jarrett', 'Colman Domingo']","['Nia DaCosta', 'Jordan Peele', 'Win Rosenfeld', 'Nia DaCosta', 'Bernard Rose', 'Clive Barker', 'Ian Cooper', 'Jordan Peele', 'Win Rosenfeld', 'Robert Aiki Aubrey Lowe', 'John Guleserian', 'Catrin Hedström', 'Cara Brower']"
368,51,76994245.0,44539245,The Forever Purge,Universal Pictures,"July 1, 2021",9 markets,R,1 hr 43 min,"['Action', 'Crime', 'Horror', 'Thriller', 'Western']",All the rules are broken as a sect of lawless marauders decides that the annual Purge does not stop at daybreak and instead should never end.,"['Ana de la Reguera', 'Tenoch Huerta', 'Josh Lucas', 'Leven Rambin']","['Everardo Gout', 'James DeMonaco', 'James DeMonaco', 'Michael Bay', 'Jason Blum', 'James DeMonaco', 'Andrew Form', 'Brad Fuller', 'Sébastien K. Lemercier', 'The Newton Brothers', 'Luis David Sansans', 'Timothy Alverson', 'Todd E. Miller', 'Vincent Tabaillon', 'Jennifer Spence']"
369,52,76016171.0,38530322,West Side Story,20th Century Studios,"December 8, 2021","EMEA, APAC",PG-13,2 hr 36 min,"['Crime', 'Drama', 'Musical', 'Romance']","An adaptation of the 1957 musical, West Side Story explores forbidden love and the rivalry between the Jets and the Sharks, two teenage street gangs of different ethnic backgrounds.","['Ansel Elgort', 'Rachel Zegler', 'Ariana DeBose', 'David Alvarez']","['Steven Spielberg', 'Tony Kushner', 'Arthur Laurents', 'Kristie Macosko Krieger', 'Kevin McCollum', 'Steven Spielberg', 'Leonard Bernstein', 'Janusz Kaminski', 'Sarah Broshar', 'Michael Kahn', 'Adam Stockhausen']"
370,54,70060492.0,38014727,Hitman's Wife's Bodyguard,Lionsgate Films,"June 16, 2021","LATAM, Domestic",R,1 hr 40 min,"['Action', 'Comedy', 'Crime', 'Romance', 'Thriller']","The bodyguard, Michael Bryce, continues his friendship with assassin, Darius Kincaid, as they try to save Darius' wife Sonia.","['Ryan Reynolds', 'Samuel L. Jackson', 'Salma Hayek', 'Antonio Banderas']","['Patrick Hughes', ""Tom O'Connor"", 'Phillip Murphy', 'Brandon Murphy', ""Tom O'Connor"", ""Tom O'Connor"", 'Yariv Lerner', ""Matthew O'Toole"", 'Les Weldon', 'Atli Örvarsson', 'Terry Stacey', 'Michael J. Duthie', 'Jack Hutchings', 'Russell De Rozario']"
371,55,65774490.0,25314753,Escape Room: Tournament of Champions,Sony Pictures Releasing,"July 1, 2021",APAC,PG-13,1 hr 28 min,"['Action', 'Adventure', 'Horror', 'Mystery', 'Sci-Fi', 'Thriller']","Six people unwillingly find themselves locked in another series of escape rooms, slowly uncovering what they have in common to survive. Joining forces with two of the original survivors, they soon discover they've all played the game before.","['Taylor Russell', 'Logan Miller', 'Deborah Ann Woll', 'Thomas Cocquerel']","['Adam Robitel', 'Will Honley', 'Maria Melnik', 'Daniel Tuch', 'Oren Uziel', 'Christine Lavaf', 'Fritz Böhm', 'Bragi F. Schut', 'Neal H. Moritz', 'John Carey', 'Brian Tyler', 'Marc Spicer', 'Steve Mirkovich', 'Peter Pav', 'Edward Thomas']"
372,56,64666502.0,4018313,Belle,GKIDS,"July 16, 2021",Japan,PG,2 hr 1 min,"['Adventure', 'Animation', 'Drama', 'Family', 'Fantasy', 'Music', 'Musical', 'Sci-Fi']","Suzu is a shy high school student living in a rural village. For years, she has only been a shadow of herself. But when she enters ""U"", a massive virtual world, she escapes into her online persona as Belle, a globally-beloved singer.","['Kaho Nakamura', 'Ryo Narita', 'Shôta Sometani', 'Tina Tamashiro']","['Mamoru Hosoda', 'Mamoru Hosoda', 'Mamoru Hosoda', 'David Jesteadt', 'Genki Kawamura', 'Yûichirô Saitô', 'Stephanie Sheh', 'Michael Sinterniklaas', 'Nozomu Takahashi', 'Yûta Bandoh', 'Ludvig Forssell', 'Miho Hazama', 'Taisei Iwasaki', 'Manabu Kadôno', 'Jumi Lee', 'Tetsu Machida', 'Shigeru Nishiyama', 'Anri Jôjô', 'Eric Wong']"
373,57,60692022.0,23009270,Ron's Gone Wrong,20th Century Studios,"October 13, 2021",Netherlands,PG,1 hr 47 min,"['Adventure', 'Animation', 'Comedy', 'Family', 'Sci-Fi']","The story of Barney, an awkward middle-schooler and Ron, his new walking, talking, digitally-connected device. Ron's malfunctions set against the backdrop of the social media age launch them on a journey to learn about true friendship.","['Jack Dylan Grazer', 'Zach Galifianakis', 'Ed Helms', 'Olivia Colman']","['Sarah Smith', 'Jean-Philippe Vine', 'Octavio E. Rodriguez', 'Peter Baynham', 'Sarah Smith', 'Lara Breay', 'Julie Lockhart', 'Henry Jackman', 'David Peers', 'Hailey White', 'David Burrows', 'James Cooper', 'Sim Evan-Jones', 'Nathan Crowley', 'Aurélien Predal']"
374,63,53785551.0,32712950,Don't Breathe 2,Screen Gems,"August 12, 2021",5 markets,R,1 hr 38 min,"['Action', 'Crime', 'Horror', 'Thriller']","The sequel is set in the years following the initial deadly home invasion, where Norman Nordstrom lives in quiet solace until his past sins catch up to him.","['Stephen Lang', 'Madelyn Grace', 'Brendan Sexton III', 'Adam Young']","['Rodo Sayagues', 'Fede Alvarez', 'Rodo Sayagues', 'Fede Alvarez', 'Rodo Sayagues', 'Fede Alvarez', 'Sam Raimi', 'Rob Tapert', 'Roque Baños', 'Pedro Luque', 'Jan Kovác', 'David Warren']"
375,66,51637422.0,36501,Schemes in Antiques,Well Go USA Entertainment,"December 2, 2021",China,G,2 hr 3 min,"['Action', 'Adventure', 'Comedy', 'Crime', 'Drama', 'Mystery']","Adapted from Ma Boyong's novel of the same name, the film tells the story of a series of adventures that occurred when the descendants of the five veins made a wish to find out the truth about the Buddha head of Wu Zetian Mingtang in the Tang Dynasty.","['Jiayin Lei', 'Xian Li', 'Zhilei Xin', 'You Ge']","['Chi-Kin Kwok', 'Xiaohu Chang', 'Wenwen Fan', 'Hai Huang', 'Chi-Kin Kwok', 'Marberionius', 'Yiran Pan', 'Yahe Wang', 'Albert Yeung', 'Xuan Zhu', 'Sanping Han', 'Luca Liang', 'Wan Pin Chu', 'Jake Pollock', 'Matthew Hui']"
376,67,51074773.0,1324302,Luca,Walt Disney Studios Motion Pictures,"May 2, 2021",Hungary,PG,1 hr 35 min,"['Adventure', 'Animation', 'Comedy', 'Drama', 'Family', 'Fantasy']","On the Italian Riviera, an unlikely but strong friendship grows between a human being and a sea monster disguised as a human.","['Jacob Tremblay', 'Jack Dylan Grazer', 'Emma Berman', 'Saverio Raimondo']","['Enrico Casarosa', 'Enrico Casarosa', 'Jesse Andrews', 'Simon Stephenson', 'Jesse Andrews', 'Mike Jones', 'Julie Lynn', 'Randall Green', 'Andrea Warren', 'Dan Romer', 'David Juan Bianchi', 'Kim White', 'Catherine Apple', 'Jason Hudak', 'Daniela Strijleva']"
377,68,49158709.0,9250870,Belfast,Focus Features,"November 12, 2021",Domestic,PG-13,1 hr 38 min,"['Biography', 'Drama', 'Romance']",A young boy and his working-class Belfast family experience the tumultuous late 1960s.,"['Jude Hill', 'Lewis McAskie', 'Caitríona Balfe', 'Jamie Dornan']","['Kenneth Branagh', 'Kenneth Branagh', 'Laura Berwick', 'Kenneth Branagh', 'Becca Kovacik', 'Tamar Thomas', 'Van Morrison', 'Haris Zambarloukos', 'Úna Ní Dhonghaíle', 'Jim Clay']"
378,69,46940541.0,12271658,My Hero Academia: World Heroes' Mission,FUNimation Entertainment,"August 6, 2021",Japan,PG-13,1 hr 41 min,"['Action', 'Adventure', 'Animation', 'Fantasy', 'Sci-Fi']","When a cult of terrorists ruins a city by releasing a toxin that causes people's abilities to spiral out of control, Japan's greatest heroes spread around the world in an attempt to track down the mastermind and put him to justice.","['Daiki Yamashita', 'Nobuhiko Okamoto', 'Yûki Kaji', 'Tetsu Inada']","['Kenji Nagasaki', 'Kôhei Horikoshi', 'Yôsuke Kuroda', 'Justin Cook', 'Michael Harcourt', 'Yûki Hayashi', 'Mayuko Furumoto', 'Jeremy Jimenez', 'Daniel Mancilla']"
379,70,46333545.0,16124375,The French Dispatch,Searchlight Pictures,"October 21, 2021",EMEA,R,1 hr 47 min,"['Comedy', 'Drama', 'Romance']","A love letter to journalists set in an outpost of an American newspaper in a fictional twentieth century French city that brings to life a collection of stories published in ""The French Dispatch Magazine"".","['Benicio Del Toro', 'Adrien Brody', 'Tilda Swinton', 'Léa Seydoux']","['Wes Anderson', 'Wes Anderson', 'Wes Anderson', 'Roman Coppola', 'Hugo Guinness', 'Jason Schwartzman', 'Wes Anderson', 'Jeremy Dawson', 'Steven Rales', 'Alexandre Desplat', 'Robert D. Yeoman', 'Andrew Weisblum', 'Adam Stockhausen']"
380,71,45175167.0,29975167,In the Heights,Warner Bros.,"June 10, 2021",EMEA,PG-13,2 hr 23 min,"['Drama', 'Musical', 'Romance']","In Washington Heights, a sympathetic New York bodega owner saves every penny every day as he imagines and sings about a better life.","['Anthony Ramos', 'Corey Hawkins', 'Leslie Grace', 'Melissa Barrera']","['Jon M. Chu', 'Quiara Alegría Hudes', 'Quiara Alegría Hudes', 'Lin-Manuel Miranda', 'Anthony Bregman', 'Quiara Alegría Hudes', 'Mara Jacobs', 'Lin-Manuel Miranda', 'Scott Sanders', 'Alex Lacamoire', 'Lin-Manuel Miranda', 'Bill Sherman', 'Alice Brooks', 'Myron Kerstein', 'Nelson Coates']"
381,73,42717215.0,17716215,Spirit Untamed,Universal Pictures,"May 20, 2021",Russia/CIS,PG,1 hr 28 min,"['Adventure', 'Animation', 'Comedy', 'Family', 'Western']",Lucky Prescott's life is changed forever when she moves from her home in the city to a small frontier town and befriends a wild mustang named Spirit.,"['Isabela Merced', 'Marsai Martin', 'Mckenna Grace', 'Walton Goggins']","['Elaine Bogan', 'Ennio Torresan', 'Aury Wallington', 'Kristin Hahn', 'Katherine Nolfi', 'Aury Wallington', 'Karen Foster', 'Matthew Teevan', 'Amie Doherty', 'Robert Edward Crawford', 'R. Orlando Duenas', 'Paul Duncan']"
382,74,41914915.0,17000612,Resident Evil: Welcome to Raccoon City,Screen Gems,"November 24, 2021","Domestic, EMEA",R,1 hr 47 min,"['Action', 'Horror', 'Sci-Fi']","Set in 1998, this origin story explores the secrets of the mysterious Spencer Mansion and the ill-fated Raccoon City.","['Kaya Scodelario', 'Robbie Amell', 'Hannah John-Kamen', 'Tom Hopper']","['Johannes Roberts', 'Johannes Roberts', 'Hartley Gorenstein', 'James Harris', 'Robert Kulzer', 'Mark Korven', 'Maxime Alexandre', 'Dev Singh', 'Jennifer Spence']"
